{
  "_note": "Group 1 (first 5 collections, 50 outfits) fully authored Sep 27, 2026 per Beth's direction — was: collectible_outfits empty. Each outfit: id, collectionId, name, garment_pieces[], scoring_categories[] (from documented_scoring_categories), rarity (4 Common / 3 Fine / 2 Rare / 1 Ultra-Rare per collection), acquisition {free_path, crowns_path} — every premium outfit has a credible free path; the Triumph Gown is TIME-ONLY (never purchasable). Scoring weights hidden — never invented. Currencies: Crowns (premium), coins (soft). Groups 2-6 themes are a roadmap, not content.",
  "documented_scoring_categories": {
    "daily_challenge_occasion_dimensions": {
      "Ball": [
        "Impact",
        "harmony",
        "prestige"
      ],
      "Evening at Home": [
        "Taste",
        "softness",
        "character"
      ],
      "Masquerade/Vauxhall": [
        "Theme fit",
        "creativity",
        "event rules"
      ],
      "Morning calls": [
        "Propriety",
        "detail",
        "coordination"
      ],
      "Opera/Rout": [
        "Drama",
        "rarity",
        "silhouette"
      ],
      "Outing": [
        "Setting",
        "weather",
        "novelty"
      ],
      "Promenade": [
        "Season",
        "polish",
        "restraint"
      ]
    },
    "gazette_rubric": [
      "occasion-fit (base score)",
      "boldness bonus (color play beats monochrome)",
      "fabric coherence (intentional contrast praised; incoherent clashing critiqued, never harshly)"
    ]
  },
  "documented_system_rules": [
    "Closet collections: 30+ themed collections, surfaced in groups of 5; 10 cards per collection (4 Common, 3 Fine, 2 Rare, 1 Ultra-Rare). Completing a collection adds its garments to the permanent closet; duplicates feed the Modiste's Exchange.",
    "Card draws: five favors draw one random card; favors are earned, never bought.",
    "Jewel shelf: per level ~3 dresses + 1-2 tiaras; two pools never mixed — card-pool ultra-rares (velocity, not exclusivity; same item earnable through favor draws) and challenge-exclusives (unique to that level's challenge, never in cards, owned forever, wearable in future chapters). No shelf item gates a story outcome.",
    "No avatar unlocks — rewards are outfits, hair, accessories only.",
    "Every premium outfit needs a credible free path (long but real). Time-only items exist (never purchasable at any price)."
  ],
  "collections": [
    {
      "collectionId": "closet.morning_room",
      "title": "The Morning Room",
      "group": 1,
      "occasion": "Morning calls",
      "theme": "Daywear foundations: muslins, spencers, and the armor of respectability."
    },
    {
      "collectionId": "closet.promenade",
      "title": "The Promenade",
      "group": 1,
      "occasion": "Promenade",
      "theme": "Carriage dress, pelisses, and being seen at distance."
    },
    {
      "collectionId": "closet.assembly_rooms",
      "title": "The Assembly Rooms",
      "group": 1,
      "occasion": "Ball",
      "theme": "Evening dress for routs, the opera, and getting through doors."
    },
    {
      "collectionId": "closet.emerald_hour",
      "title": "Emerald Hour",
      "group": 1,
      "occasion": "Opera/Rout",
      "theme": "Jewel-toned evening glamour; green as a declaration."
    },
    {
      "collectionId": "closet.triumph",
      "title": "Triumph",
      "group": 1,
      "occasion": "Ball",
      "theme": "S1's climax wardrobe, from refuge to triumph."
    }
  ],
  "collectible_outfits": [
    {
      "id": "card.muslin_morning",
      "collectionId": "closet.morning_room",
      "name": "Muslin Morning Gown",
      "garment_pieces": [
        "White muslin round gown",
        "Cambric chemisette",
        "Plain sash"
      ],
      "scoring_categories": [
        "Propriety",
        "detail",
        "coordination"
      ],
      "rarity": "Common",
      "acquisition": {
        "free_path": "Favor draws · Group 1 (pity: Rare+ guaranteed every 20 draws, Ultra-Rare every 80)",
        "crowns_path": "Jewel shelf · 20 Crowns"
      },
      "art_notes": "Plain white muslin, long sleeves, morning light; utterly respectable."
    },
    {
      "id": "card.sprig_day",
      "collectionId": "closet.morning_room",
      "name": "Sprigged Day Dress",
      "garment_pieces": [
        "Sprig-printed muslin gown",
        "Straw bonnet",
        "Kid gloves"
      ],
      "scoring_categories": [
        "Propriety",
        "detail",
        "coordination"
      ],
      "rarity": "Common",
      "acquisition": {
        "free_path": "Favor draws · Group 1 (pity: Rare+ guaranteed every 20 draws, Ultra-Rare every 80)",
        "crowns_path": "Jewel shelf · 20 Crowns"
      },
      "art_notes": "Small sprig print on ivory; bonnet tied under the chin."
    },
    {
      "id": "card.cambric_walking",
      "collectionId": "closet.morning_room",
      "name": "Cambric Walking Dress",
      "garment_pieces": [
        "Cambric walking dress",
        "Nankeen spencer",
        "Half-boots"
      ],
      "scoring_categories": [
        "Propriety",
        "detail",
        "coordination"
      ],
      "rarity": "Common",
      "acquisition": {
        "free_path": "Favor draws · Group 1 (pity: Rare+ guaranteed every 20 draws, Ultra-Rare every 80)",
        "crowns_path": "Jewel shelf · 20 Crowns"
      },
      "art_notes": "Crisp cambric, spencer buttoned to the throat; made for errands."
    },
    {
      "id": "card.grey_merino",
      "collectionId": "closet.morning_room",
      "name": "Grey Merino Morning Dress",
      "garment_pieces": [
        "Dove-grey merino gown",
        "White fichu",
        "Morning cap"
      ],
      "scoring_categories": [
        "Propriety",
        "detail",
        "coordination"
      ],
      "rarity": "Common",
      "acquisition": {
        "free_path": "Favor draws · Group 1 (pity: Rare+ guaranteed every 20 draws, Ultra-Rare every 80)",
        "crowns_path": "Jewel shelf · 20 Crowns"
      },
      "art_notes": "Quiet dove grey; the cap says at-home, the cut says standards."
    },
    {
      "id": "card.blue_spencer",
      "collectionId": "closet.morning_room",
      "name": "Blue Spencer Ensemble",
      "garment_pieces": [
        "Blue jaconet gown",
        "Matching spencer jacket",
        "Bonnet with blue ribbons"
      ],
      "scoring_categories": [
        "Propriety",
        "detail",
        "coordination"
      ],
      "rarity": "Fine",
      "acquisition": {
        "free_path": "Favor draws · Group 1 (pity: Rare+ guaranteed every 20 draws, Ultra-Rare every 80); S1 L8 commission reward",
        "crowns_path": "Jewel shelf · 60 Crowns"
      },
      "art_notes": "Head-to-toe cornflower blue; correct to the inch for the promenade hour."
    },
    {
      "id": "card.tea_party_muslin",
      "collectionId": "closet.morning_room",
      "name": "Tea-Party Muslin",
      "garment_pieces": [
        "Fine India muslin gown",
        "Scarlet ribbon sash",
        "Kid gloves"
      ],
      "scoring_categories": [
        "Propriety",
        "detail",
        "coordination"
      ],
      "rarity": "Fine",
      "acquisition": {
        "free_path": "Favor draws · Group 1 (pity: Rare+ guaranteed every 20 draws, Ultra-Rare every 80); S1 L4 commission reward",
        "crowns_path": "Jewel shelf · 60 Crowns"
      },
      "art_notes": "Pretty and unthreatening — except the scarlet ribbon, chosen because Julian might hear of the tea."
    },
    {
      "id": "card.letter_writing",
      "collectionId": "closet.morning_room",
      "name": "Letter-Writing Dress",
      "garment_pieces": [
        "Lavender-grey gown",
        "Lace fichu",
        "Cameo brooch"
      ],
      "scoring_categories": [
        "Propriety",
        "detail",
        "coordination"
      ],
      "rarity": "Fine",
      "acquisition": {
        "free_path": "Favor draws · Group 1 (pity: Rare+ guaranteed every 20 draws, Ultra-Rare every 80)",
        "crowns_path": "Jewel shelf · 60 Crowns"
      },
      "art_notes": "For stillness and the writing desk; the cameo is grandmother's."
    },
    {
      "id": "card.fitting_gown",
      "collectionId": "closet.morning_room",
      "name": "Atelier Fitting Gown",
      "garment_pieces": [
        "Unfinished silk gown, basted seams",
        "Chalk marks in Élise's hand",
        "Pin-cushion chatelaine"
      ],
      "scoring_categories": [
        "Propriety",
        "detail",
        "coordination"
      ],
      "rarity": "Rare",
      "acquisition": {
        "free_path": "S1 L3 story commission reward (also Favor draws · Group 1 (pity: Rare+ guaranteed every 20 draws, Ultra-Rare every 80))",
        "crowns_path": "Fashion Plate rotation · 140 Crowns"
      },
      "art_notes": "A gown mid-becoming: basting stitches, chalk lines, promise."
    },
    {
      "id": "card.garden_morning",
      "collectionId": "closet.morning_room",
      "name": "Garden Morning Dress",
      "garment_pieces": [
        "Green-sprigged gown",
        "Straw hat with green ribbons",
        "Wicker basket"
      ],
      "scoring_categories": [
        "Propriety",
        "detail",
        "coordination"
      ],
      "rarity": "Rare",
      "acquisition": {
        "free_path": "Park restoration: Walled Garden zone reward (also Favor draws · Group 1 (pity: Rare+ guaranteed every 20 draws, Ultra-Rare every 80))",
        "crowns_path": "Fashion Plate rotation · 140 Crowns"
      },
      "art_notes": "Made for the still-unrestored garden; the basket is for cuttings."
    },
    {
      "id": "card.dowagers_approval",
      "collectionId": "closet.morning_room",
      "name": "The Dowager's Approval",
      "garment_pieces": [
        "Pearl-grey silk morning gown",
        "Brussels lace lappets",
        "Pearl brooch"
      ],
      "scoring_categories": [
        "Propriety",
        "detail",
        "coordination"
      ],